{
  "format": "litodoc-site",
  "version": 1,
  "title": "litodoc fixture",
  "output": "build/site",
  "data_output": "build/site-data",
  "frontend": null,
  "data_only": false,
  "data_api": 4,
  "template_api": 1,
  "packages": [
    {
      "name": "litodoc-fixture",
      "version": "0.1.0",
      "root_module": "",
      "profile": "debug",
      "root": "tests",
      "toolchain_version": "22.1.8",
      "toolchain_target": "x86_64-unknown-linux-gnu",
      "language_standard": "c++20",
      "responses": [
        {
          "path": "tests/fixtures/basic-response.json",
          "digest": "55cee340cd86e86b6e875ef425f62e09d06d40c7b5b0b3c74cc36b13c8c34a7d"
        }
      ]
    }
  ]
}
